{"authority_effect":"none","call_id":null,"code":"unauthenticated-channel","effect_may_have_started":false,"public_message":"This channel has no current verified reader authentication.","recovery_policy":"no-retry","request_byte_sha256":"ffea8892772956870a894eb69032f845d913b423b3cf6d2701f5692f82885cc0","schema_version":"lab-api-transport-error/v1-candidate"}